ID,Beneficio Esperado,Descripción,Estado,Fuente de Elicitación,Nombre del Requisito de Negocio,Objetivo Institucional Relacionado,Prioridad
RQ-NEG-001,Mejora ≥15% pre/post en rúbrica de intervención y toma de decisiones (cohortes comparables).,"La institución debe disponer de una plataforma de simulación gamificada que permita practicar toma de decisiones psicosociales en múltiples casos situacionales, con rutas ramificadas, herramientas y retroalimentación.",Propuesto,Caso de estudio,Reducir brecha teoría–práctica con simulaciones multi-caso,Mejorar la formación práctica y la pertinencia curricular mediante metodologías activas de aprendizaje.,Alta
RQ-NEG-002,"≥80% de estudiantes alcanza nivel “Aceptable” o superior en competencias definidas, en al menos un intento final.","La plataforma debe soportar entrenamiento por competencias transferibles (contención, comunicación, valoración, activación de rutas) aplicables a diversos casos.",Propuesto,Entrevista docente,Entrenar competencias psicosociales transferibles,Asegurar resultados de aprendizaje por competencias profesionales y responsabilidad social.,Alta
RQ-NEG-004,≥85% satisfacción (encuesta) y evidencia de aprendizaje clave en ≥90% de intentos.,"La plataforma debe facilitar práctica deliberada, retroalimentación formativa y bitácora para fomentar transferencia a contextos reales.",Propuesto,Análisis documental,Soportar aprendizaje activo y reflexión,Innovación educativa y fortalecimiento del modelo pedagógico institucional.,Media
RQ-NEG-003,Reducción ≥20% de decisiones no recomendadas entre intento 1 vs 2; bitácora con reflexión ética en ≥90% de cierres.,"La solución debe asegurar que los casos con contenido sensible se gestionen con advertencias, controles de seguridad y criterios de no revictimización, sin restringir la plataforma a un único tipo de caso.",Propuesto,Revisión normativa,Garantizar enfoque ético y de derechos en simulaciones,"Formación integral con enfoque ético, de derechos humanos y cumplimiento normativo.",Alta
RQ-NEG-005,≥90% intentos evaluados con desglose y comentario accionable; mejora ≥10% tras retroalimentación.,"La solución debe permitir evaluación por competencias con rúbricas, comentarios y seguimiento por intento para orientar reintentos y tutorías.",Propuesto,Entrevista docente,Habilitar evaluación formativa y seguimiento docente,Mejorar la calidad académica mediante evaluación auténtica y formativa.,Alta
RQ-NEG-006,Reportes por grupo/estudiante en ≤3 clics; uso documentado de analíticas en ajustes docentes por periodo.,"La plataforma debe generar analíticas individuales y agregadas para detectar brechas, ajustar la docencia y mejorar casos.",Propuesto,Caso de estudio,Analíticas para mejora continua del proceso formativo,Gestión basada en evidencia para mejora continua del proceso formativo.,Media
RQ-NEG-007,Crear variante de caso en ≤4 h reutilizando ≥60% de componentes; historial consultable.,"La solución debe permitir crear, versionar y reutilizar casos, herramientas y recursos para múltiples cohortes y asignaturas.",Propuesto,Validación experta,Escalar el catálogo con reutilización y versionamiento,Sostenibilidad y escalabilidad de recursos educativos digitales.,Media
RQ-NEG-008,Versiones publicadas con checklist de validación ≥95% y registro de aprobaciones por rol.,La plataforma debe soportar un flujo de validación y aprobación por roles antes de publicar versiones de casos al estudiantado.,Propuesto,Validación experta,Validación interdisciplinar antes de publicar,Aseguramiento de calidad e integración interdisciplinar en proyectos académicos.,Alta